text,clean_text,tfidf_cluster
"Everyone says you should talk about what's bothering you, but when you finally find the courage to say anything, the response is so bad that you promise yourself to never open up again",everyone say talk whats bothering finally find courage say anything response bad promise never open,2
I hate that depression can just “sleep” for a while and then come back up full force.,hate sleep come back full force,2
Absolutely nothing interests me anymore. I fucking hate it.,absolutely nothing interest anymore hate,2
High functioning depression is so easily over looked,high functioning easily looked,2
"Fuck this shit dude, how in the hell is anyone supposed to keep up with scjool, work, social life, healthy eating + exercise, and hobbies?",shit dude hell anyone supposed keep scjool work social life healthy eating exercise hobby,2
I hate how fast I go from being okay to empty and depressed,hate fast okay empty,2
Nobody gives a fucking shit about you until you mention killing yourself.,nobody give shit mention killing,2
It hit me how abnormal deppression is. Like we are actually mentally ill.,hit abnormal deppression like actually mentally ill,2
I shouldn't have to lie about my depression to get a sick day,shouldnt lie get sick day,2
I secretly hope that I will be diagnosed with a terminal illness so I can die without taking my own life,secretly hope diagnosed terminal illness die without taking life,2
My therapist gave me an advice that I wanted to share,therapist gave advice wanted share,2
I don't want to kill myself but I wish I was never born,dont want kill wish never born,0
I feel like depression makes me more stupid,feel like make stupid,2
I want to exist when everyone’s paused,want exist everyones paused,0
Does anyone else experience anger as a part of depression?,anyone else experience anger part,2
How many other people go to sleep wishing they'll die peacefully before they wake up?,many people sleep wishing theyll die peacefully wake,2
i like being alone but i hate being alone,like alone hate alone,2
I deleted my note!,deleted note,2
i want a hug,want hug,0
Sleeping is the only activity I don't hate because it's like a free trial of not existing,sleeping activity dont hate like free trial existing,2
I’m sorry.,sorry,2
"My friend attempted suicide a couple days ago. My family is saying I will ""ruin Christmas"" if I spend time with her in the hospital on Christmas Eve instead of visiting them. What can I do?",friend attempted suicide couple day ago family saying ruin christmas spend time hospital christmas eve instead visiting,2
"i feel like when a lot of other people say they did nothing all day, its completely different than when i do nothing all day.",feel like lot people say nothing day completely different nothing day,2
"I don’t wanna kill myself, but its 4:49am, I’m about to go to bed and I’m thinking about how nice it would be if I just died in my sleep.",dont wan na kill bed thinking nice would died sleep,2
"I almost checked myself into the hospital because i was at my breaking point 2 days ago. I punked out. Then, i decided to call for therapy instead and i got an appointment right away and i’m already meeting with a psychiatrist this weekend!",almost checked hospital breaking point day ago punked decided call therapy instead got appointment right away already meeting psychiatrist weekend,2
I often fantasize about something tragic happening to me so I have a reason to be depressed or don't have to participate in life for a little while,often fantasize something tragic happening reason dont participate life little,2
Normalise 👏 Men 👏Crying 👏,normalise men cry,2
"Why is it that people will call you lazy or weak for not wanting to do anything ever, but then will tell you that suicide isn't the answer?",people call lazy weak wanting anything ever tell suicide isnt answer,2
Don’t you hate it when you’re having a particularly bad day and your mood is really low but friends/family just assume you’re in a bad mood with them?,dont hate youre particularly bad day mood really low friendsfamily assume youre bad mood,2
"I’m 19, my girlfriend was murdered, the trial is soon and I’m getting more and more depressive",girlfriend murdered trial soon getting depressive,2
When you're lying in bed and you slowly feel tears from in your eyes and roll down your face you know its back. But it's not even back because it hasn't left in the first place.,youre lying bed slowly feel tear eye roll face know back even back hasnt left first place,2
I just want to feel taken care of,want feel taken care,0
I think my wife saved my life this morning.,think wife saved life morning,2
Does anyone else sleep a lot to escape the pain?,anyone else sleep lot escape pain,2
Lol my suicide note from 3 years ago was so formal,lol suicide note year ago formal,2
I was crying today when my kitten was lying in bed with me. She saw I was crying and she licked my tears. I feel so blessed to have her. Just started crying more but this time from happiness.,cry today kitten lying bed saw cry licked tear feel blessed started cry time happiness,2
My 17yo lovebug doesn't remember me anymore,lovebug doesnt remember anymore,2
Can anyone else go from feeling neutral to hopeless in a matter of seconds because of something small?,anyone else feeling neutral hopeless matter second something small,2
"I decided to tell people ""I am not okay"" when close friends ask me ""how are you? Here is how it went...",decided tell people okay close friend ask went,2
Being alive is a scam,alive scam,2
"I want a hug. A real one. Not a hug of pity, not a virtual hug.",want hug real one hug pity virtual hug,2
I remember thinking about people who had depression. Now I’ve had it for two years and it’s impossible for me to believe that there are actually people who aren’t depressed.,remember thinking people two year impossible believe actually people arent,2
I want to go home.,want home,0
passively suicidal?,passively suicidal,2
Does anyone feel like the less interesting person while hanging around other people?,anyone feel like le interesting person hanging around people,2
I’m killing myself [update],killing update,2
Why do I feel bothered and ashamed by things that sometimes happened literally over 10 years ago and the only person that probably remembers is me?,feel bothered ashamed thing sometimes happened literally year ago person probably remembers,2
"People don't realize that coming over and just sitting with you, watching tv or having food or whatever, while you're depressed is the best feeling.",people dont realize coming sitting watching food whatever youre best feeling,2
"Does anyone habitually say things like ""I fucking hate myself""",anyone habitually say thing like hate,2
"Is it just me, or is it like you dont actually have a reason to be depressed but then just all of a sudden you are just overwhelmed in sadness?",like dont actually reason sudden overwhelmed sadness,2
"I'm not living, I'm just existing",living existing,2
I hate when you finally start to feel a bit better in life but then a bout of depression crashes down like a wave.,hate finally start feel bit better life bout crash like wave,2
I wish I could give my life to someone who actually wants to live,wish could give life someone actually want live,0
I feel like I'm wasting my life being depressed.,feel like wasting life,2
Just realized why I stay up all night and don't want to sleep.,realized stay night dont want sleep,0
"“People with depression don’t want to die, they just don’t want to be alive”",people dont want die dont want alive,0
I’ve been working out the last 150 days. I want to kill myself even more,working last day want kill even,0
Forcing myself to do things makes me hate them. Doing nothing makes me hate myself.,forcing thing make hate nothing make hate,2
"Anyone else have underlying sadness even when doing something ""fun""?",anyone else underlying sadness even something fun,2
I wish I was a fucking amoeba,wish amoeba,2
Realizing that you will die because of suicide is really hard.,realizing die suicide really hard,2
High functioning depression is really just barely functioning,high functioning really barely functioning,2
I isolate myself and then feel angry when people don’t notice.,isolate feel angry people dont notice,2
Anybody else feel like they're quietly panicking all of the time?,anybody else feel like theyre quietly panicking time,2
"Do you ever lay there in the dark, just staring into the nothingness, and then 5 hours went by somehow and you cant remember if you fell asleep or not.",ever lay dark staring nothingness hour went somehow cant remember fell asleep,2
"Having wonderful, loving, supportive family doesn’t make you any less depressed.",wonderful loving supportive family doesnt make le,2
Feel like I'll never be able to have a normal loving relationship because of my depression and my personality,feel like ill never able normal loving relationship personality,2
Anyone feels jealous and bitter that you’re stagnating while everyone around you is moving forward?,anyone feel jealous bitter youre stagnating everyone around moving forward,2
"It sucks how my bullies are living their best lives (having sex, traveling and having fun) why I'm suffering lonely at home crying everyday all day.",suck bully living best life sex traveling fun suffering lonely home cry everyday day,2
nobody cares when you're depressed until you commit suicide,nobody care youre commit suicide,2
"I convinced myself I was going to commit suicide sometime in the next 2 weeks. Then I walked to the kitchen and saw my beautiful, loving family. Now I cant stop crying",convinced going commit suicide sometime next week walked kitchen saw beautiful loving family cant stop cry,2
I'm so fucking tired of begging for help. I NEED HELP. Being ignored is why I'm going to wind up dead.,tired begging help need help ignored going wind dead,2
"Anyone else feel like their ""fake depressed""?",anyone else feel like fake,2
Am i the only one who apologizes profusely for being a burden on others?,one apologizes profusely burden others,2
"Depression is the hot funny meme until you're not sleeping, not eating, and hoping you'll die in a car accident",hot funny meme youre sleeping eating hoping youll die car accident,2
"I don't want to live anymore. This doesn't mean I want to kill myself. It just means I'd be totally cool if a plane just nosedived into my bedroom right now. Or if a sniper took me out. I want to die, just not kill myself.",dont want live anymore doesnt mean want kill mean totally cool plane nosedived bedroom right sniper took want die kill,0
"One of the worst side effects of my depression is the brain fog, but I never see anyone talk about it.",one worst side effect brain fog never see anyone talk,2
One of the shittiest feelings is having a dream where you're genuinely happy then waking up to reality.,one shittiest feeling dream youre genuinely happy waking reality,2
"Does anyone else get random moments of clarity where you think ""oh crap, I'm actually very mentally ill.""",anyone else get random moment clarity think crap actually mentally ill,2
"Depression can cause weight gain or weight loss, but saying you've not been eating is seen as much more socially acceptable than saying you've been eating too much. Even though the cause is pretty much the same.",cause weight gain weight loss saying youve eating seen much socially acceptable saying youve eating much even though cause pretty much,2
"I'm so unhappy with my life, that I cope by living in a fantasy world I created in my head.",unhappy life cope living fantasy world created head,2
I wish I could have a fatal accident instead of committing suicide.,wish could fatal accident instead committing suicide,2
Sleeping is better than being awake.,sleeping better awake,2
I play video games every waking moment so I can avoid thinking.,play video game every waking moment avoid thinking,2
I just killed my pet bird.,killed pet bird,2
I feel like I’m getting dumber and dumber everyday.,feel like getting dumber dumber everyday,2
Addicted to depression,addicted,2
Why the fuck does being alive always have to feel like an uphill battle. I can't fucking ever keep up.,alive always feel like uphill battle cant ever keep,2
I hate waking up from a dream where I'm happy,hate waking dream happy,2
"Going to therapy feels like repeatedly opening the fridge hoping new food has magically appeared, but not finding any",going therapy feel like repeatedly opening fridge hoping new food magically appeared finding,2
Waking up the day after you planned on killing yourself feels like glitching outside the map in a video game,waking day planned killing feel like glitching outside map video game,2
the longer my depression goes on it feels like i just get dumber,longer go feel like get dumber,2
"I don't want to die, I just don't want to exist",dont want die dont want exist,0
"I’m not lazy, I’m depressed",lazy,2
The fact that I'm supposed to keep living and I'm not allowed to kill myself annoys me honestly.,fact supposed keep living allowed kill annoys honestly,2
the worst part about having a mental illness is that people want you to act like you don’t have one,worst part mental illness people want act like dont one,0
I’ve been diagnosed for 20 years - yesterday I quit my $100k+ high pressure sales job to become an 8th grade science teacher.,diagnosed year yesterday quit high pressure sale job become grade science teacher,2
Perhaps what's worse than depression is not being able to realize if you're having the best time of your life or the worst because it all feels the same.,perhaps whats worse able realize youre best time life worst feel,2
"I called the suicide hotline, the lady seemed irritated and then abruptly put me on hold.",called suicide hotline lady seemed irritated abruptly put hold,2
I had a personality once but now I can't remember who i am,personality cant remember,2
"God dammit. I should be able to tell people I have suicidal thoughts sometimes without them freaking the fuck out. I feel like killing myself sometimes. There, I said it. Doesn't mean I'm going to do it.",god dammit able tell people suicidal thought sometimes without freaking feel like killing sometimes said doesnt mean going,2
"Is ""bearable"" the best it's ever going to get?",bearable best ever going get,2
"Depression is when you don't really care about anything, anxiety is when you care too much about everything. And having both is just like hell.",dont really care anything anxiety care much everything like hell,2
I feel like mental illness is the only medical condition where people wished they had cancer instead,feel like mental illness medical condition people wished cancer instead,2
"Woke up, realized it was Christmas, and broke down sobbing.",woke realized christmas broke sobbing,2
I wish I could donate my life to someone who actually deserves it,wish could donate life someone actually deserves,2
Nobody talks about the memory loss,nobody talk memory loss,2
It’s my 25th birthday today. Even though I don’t mind living in solitude and actually prefer it often due to my mental illness symptoms— birthdays remind me how much it is my own fault and my mental illness made me lose all friends in my life and that I truly am alone.,birthday today even though dont mind living solitude actually prefer often due mental illness symptom birthday remind much fault mental illness made lose friend life truly alone,2
"Cheers to everyone on here, this sub is the only place I feel accepted. We may be depressed, but we are never dicks to one another or reject each other's voices.",cheer everyone sub place feel accepted may never dick one another reject others voice,2
Just because someone has it worse doesn’t make your pain unjustified.,someone worse doesnt make pain unjustified,2
Does anyone else wish that you could sleep forever?,anyone else wish could sleep forever,2
"If it was possible for me to instantly erase my existence from the world, I’d do it. I don’t want to leave anything behind or hurt anybody. I just want it to be like I never existed in the first place.",possible instantly erase existence world dont want leave anything behind hurt anybody want like never existed first place,0
I feel like my life is a TV series that should've been cancelled 4 seasons ago,feel like life series shouldve cancelled season ago,2
I don't understand how people wth depression complete college/university courses.,dont understand people wth complete collegeuniversity course,2
Burst into tears because of Animal Crossing,burst tear animal crossing,2
Anyone else just feel bored of everything?,anyone else feel bored everything,2
"Anyone else used to be bright in school, but now feel like a bum?",anyone else used bright school feel like bum,2
Anyone else stay awake late just because the idea of “tomorrow” feeling exactly like today is such a depressing thought?,anyone else stay awake late idea tomorrow feeling exactly like today thought,2
Beirut Explosion ended me,beirut explosion ended,2
I feel like years of depression has given me brain damage,feel like year given brain damage,2
I (attempted) suicide by crashing my car into a highway median at 200 km/h and walked out with a minor concussion. I feel like it's a sign I need to step up my action against depression. What are some things I can do to alleviate my depression?,attempted suicide crashing car highway median kmh walked minor concussion feel like sign need step action thing alleviate,2
I’ve been staying up until 5am playing video games and then sleeping until 3-4pm everyday,staying playing video game sleeping everyday,2
I want to improve. I want my life to get better. But holy fuck I'm so tired.,want improve want life get better holy tired,0
"no identity, no personality",identity personality,2
Anne Frank,anne frank,2
"I don't want to kill myself, but if I were to die tomorrow I would be happy",dont want kill die tomorrow would happy,0
Does anyone else get morning depression?,anyone else get morning,2
I feel like suicide is inevitable,feel like suicide inevitable,2
“I can’t try to commit suicide tonight because if I fail and survive I have work in the morning.”,cant try commit suicide tonight fail survive work morning,2
I wanted to kill myself at 8 years old so I swallowed a bunch of Flintstone vitamins.,wanted kill year old swallowed bunch flintstone vitamin,2
Done with waiting for change. Done with hoping things will get better. I’m going to push myself even harder now ... even if it kills me!,done waiting change done hoping thing get better going push even harder even kill,2
Did your depression mess with your attention span?,mess attention span,2
i'm not doing any better i just got better at hiding it.,better got better hiding,2
Anyone else feel like maybe you are just starting to get it together and then one little f*&# up sends you plummeting into the abyss again?,anyone else feel like maybe starting get together one little sends plummeting abyss,2
I want someone to notice how not okay i really am,want someone notice okay really,0
It hurts realizing who you really are,hurt realizing really,2
Holy fucking shit I can’t stop beating myself up over past mistakes,holy shit cant stop beating past mistake,2
"""Suicide isn't an answer"" Yes, but it seems like an option.",suicide isnt answer yes seems like option,2
literally the only thing in my life keeping me from going completely off the rails is my cat,literally thing life keeping going completely rail cat,2
I’ve been in quarantine in my head for 2 years,quarantine head year,2
“I used to think that the worst thing in life was to end up alone. It's not. The worst thing in life is to end up with people who make you feel alone“,used think worst thing life end alone worst thing life end people make feel alone,2
"25, an aging, worthless failure",aging worthless failure,2
I love sleeping because my dreams are better than reality,love sleeping dream better reality,2
"I am so tired of ""just taking it one day at a time""",tired taking one day time,1
"I think about suicide everyday, but I’m not planning it",think suicide everyday planning,2
Does anyone else feel like being depressed is just part of them? and its something that they will never be able to change about themselves or 'cure'?,anyone else feel like part something never able change cure,2
Trying to succeed in college when you’re depressed fucking sucks.,trying succeed college youre suck,2
I made it.,made,2
I want to do things but I never DO them,want thing never,0
"I hate myself so much I actually repeat the phrase ""I hate myself"" to myself multiple times a day.",hate much actually repeat phrase hate multiple time day,2
I'm addicted to everything that helps me forget that I'm me,addicted everything help forget,2
Made a new friend,made new friend,2
I lost my girl and just want to die,lost girl want die,0
I have no personality,personality,2
Does anyone else want to kill themself but they don’t want to do that to their family so they go by day by day with the only true motivation in their life being the day they finally grow distant enough from their family that they can end it all without the guilt,anyone else want kill themself dont want family day day true motivation life day finally grow distant enough family end without guilt,0
Does anyone weirdly find comfort in their depression?,anyone weirdly find comfort,2
Did anyone else's depression fuck up their career or university/schooling experience?,anyone el career universityschooling experience,2
Ghosting my close friends.,ghosting close friend,2
please someone just fucking read this,please someone read,2
It's lonely.,lonely,2
You ever wonder if your just faking it,ever wonder faking,2
being alive is so fucking painful,alive painful,2
I hate how depression makes everything seem exhausting.,hate make everything seem exhausting,2
Scared of sleeping because tomorrow will start,scared sleeping tomorrow start,2
"i don’t wanna kill myself, but i don’t want to necessarily exist either?",dont wan na kill dont want necessarily exist either,0
My therapist let me in on THE REAL REASON why they care if you end your life,therapist let real reason care end life,2
Have you ever had to physically “fight” with your own mind just to keep yourself together?,ever physically fight mind keep together,2
Depression turned me into an idiot.,turned idiot,2
Anyone wish there is a redo?,anyone wish redo,2
Has anyone ever felt they won’t ever reach their full potential because of their depression?,anyone ever felt wont ever reach full potential,2
Anyone else previously cared way too much and now is completely apathetic to everything?,anyone else previously cared way much completely apathetic everything,2
I'm just saying I've never been thankful that I didn't kill myself,saying never thankful didnt kill,2
Have you guys ever felt like doing something but depression just makes you stay in bed?,guy ever felt like something make stay bed,2
I wanted to kill my self last night but instead I called an ambulance,wanted kill self last night instead called ambulance,2
"i want to tell people ""don't worry, i hate myself way more than you could ever hate me""",want tell people dont worry hate way could ever hate,0
Do you ever feel too ugly to leave the house?,ever feel ugly leave house,2
I'm a 13 year old boy who is abused and need help,year old boy abused need help,2
Anybody ever been depressed since a child but only realised it was depression when you got older?,anybody ever since child realised got older,2
Please don’t give up on me,please dont give,0
y’all ever just give up mid-day and zone the fuck out and start staring into space for prolonged periods of time?????,yall ever give midday zone start staring space prolonged period time,2
"Y'all ever want someone to check on you, but at the same time be left alone?",yall ever want someone check time left alone,2
I fucking hate being depressed all the time,hate time,2
I'm so fucking depressed it took me three days to find the strength to microwave an instant meal.,took three day find strength microwave instant meal,2
"You ever want to cry but, physically can’t",ever want cry physically cant,0
Does anyone else hurt so much emotionally that it feels physical?,anyone else hurt much emotionally feel physical,2
Is anyone also more happy/relaxed when no one's around?,anyone also happyrelaxed one around,2
23 F. I feel so behind Everyone. I feel like a 13 year old.,feel behind everyone feel like year old,2
I have no personality,personality,2
You’re depressed because you’re not grateful,youre youre grateful,2
"Nobody at all cares how depressed you are when you're alive, as long as you don't kill yourself. Now if I kill myself, then I'm just a huge selfish jerk who didn't think about anybody. Jerks...",nobody care youre alive long dont kill kill huge selfish jerk didnt think anybody jerk,2
"Fuck me, I'm so tired of pretending.",tired pretending,1
"Each month that passes I feel sadder and sadder. Please, somebody read me.",month pass feel sadder sadder please somebody read,2
How the f*** can I work 40 hours a week if I can barely get the energy to brush my teeth?,work hour week barely get energy brush teeth,2
I’m 20 but in my head I feel like I’m 16,head feel like,2
I'm too fucked up. I just exist. I doubt anyone will care to read this... they never do.,fucked exist doubt anyone care read never,2
I don't want to kill myself but I just wish there was a way to stop existing.,dont want kill wish way stop existing,0
Do you ever feel guilty that your parents got stuck with such an incompetent failure?,ever feel guilty parent got stuck incompetent failure,2
