text,clean_text,tfidf_cluster
Tired of feeling “sad”,tired feeling sad,1
i hope i die honestly,hope die honestly,2
Depression got me acting like a goddamn baby,got acting like goddamn baby,2
Im just lonely,lonely,2
I can’t do this anymore,cant anymore,2
There's no such thing as help. Depression for life. Help is bullcrap. I'm alone,there thing help life help bullcrap alone,2
"Ever uttered the words ""I hate me""?",ever uttered word hate,2
why am i still depressed even though i’m doing everything “right”?,still even though everything right,2
I wish my mom never had me at all.,wish mom never,2
My husband is sinking,husband sinking,2
Winter is coming,winter coming,2
I wish I had a terminal illness.,wish terminal illness,2
Depression never really goes away,never really go away,2
can i just die already?,die already,2
depression never truly goes away,never truly go away,2
Depression can take the beauty out of everything sometimes,take beauty everything sometimes,2
Kind of tired of exsisting tbh.,kind tired exsisting tbh,2
I feel like i have no future,feel like future,2
I’m losing my battle with depression,losing battle,2
48 hours to go ,hour,2
How do people live till their old age?,people live till old age,2
I am a 14 year old guy. I wanna kill myself,year old guy wan na kill,2
"""Friends"" went on an ignorant, judgmental tangent about depression being nonsense, etc",friend went ignorant judgmental tangent nonsense etc,2
I’ve found that my depression runs on a cycle,found run cycle,2
Can depression destroy all interest in anything?,destroy interest anything,2
Yesterday I (31F) was thinking about my suicide method...,yesterday thinking suicide method,2
how do I tell a doctor I’m sad and lowkey want to die…without saying that?,tell doctor sad lowkey want diewithout saying,2
What can you do besides isolate yourself?,besides isolate,2
"my brother found my depression room, feeling immense shame",brother found room feeling immense shame,2
My parents loudly talking about my insecurities at family gathering,parent loudly talking insecurity family gathering,2
Waking Up Extremely Depressed,waking extremely,2
"Crying in bed, wishing I would just die already",cry bed wishing would die already,2
i have to go to the dentist soon i’m scared,dentist soon scared,2
Can you be depressed without an actual reason?,without actual reason,2
I feel so sad when i look at young pics of me,feel sad look young pic,2
Struggling with the fact that some people are just dealt with better lives.,struggling fact people dealt better life,2
Please talk to me…i only have the voice in my head,please talk mei voice head,2
Is it normal to feel like shit in the nights?,normal feel like shit night,2
Cops came to my house today cause I said I've been suicidal and depressed in a jury duty summons text reply box. Oof,cop came house today cause said suicidal jury duty summons text reply box oof,2
"I was planning my suicide attempt, then my brother attempted to take his own life",planning suicide attempt brother attempted take life,2
Friend just saved me,friend saved,2
Suicide - I am Christian,suicide christian,2
Living is exhausting,living exhausting,2
I can't get out of bed,cant get bed,2
Depression feels worse when you get over 45 as you become more aware of time that’s passed and how short life is,feel worse get become aware time thats passed short life,2
I feel sorry for my mom,feel sorry mom,2
i’ve written my suicide letter,written suicide letter,2
Having clinical depression let's you see humanity in its true darkness,clinical let see humanity true darkness,2
"I can't live anymore, but I have cats",cant live anymore cat,2
Do u guys ever face stomach issues due to depression?,guy ever face stomach issue due,2
Its pointless,pointless,2
It doesn’t fucking get better,doesnt get better,2
Anti depressants not working,anti depressant working,2
I wish I was happy,wish happy,2
Life isn’t worth living ,life isnt worth living,2
You’re told to ‘act as if you are fine’ or otherwise you’re a negative person,youre told act fine otherwise youre negative person,2
I feel that I’m missing out on everything.,feel missing everything,2
"If nothing changes by the time I'm 30, I'm checking out.",nothing change time checking,2
The funny thing about depression is no matter how much you try to busy yourself it’s still there,funny thing matter much try busy still,2
Never tell people or show to people you have depression. People tend to shun you or treat you worse as a result.,never tell people show people people tend shun treat worse result,2
I will never be happy,never happy,2
Hate waking up every day,hate waking every day,2
I can genuinely kill myself and no one would care.,genuinely kill one would care,2
Why bother posting,bother posting,2
I'm Attempting Suicide Tonight,attempting suicide tonight,2
Will 2024 be worth it to get through? Or should I just kill myself by the 31st of December?,worth get kill december,2
Why do some people sleep more vs less,people sleep le,2
I hate when people say “I’m so depressed” when there just feeling a bit down,hate people say feeling bit,2
I’m sick of the hypocrisy and bullshit surrounding “getting help”,sick hypocrisy bullshit surrounding getting help,2
I'm Going to Commit Suicide (pray for me),going commit suicide pray,2
Hypocrisy of this world,hypocrisy world,2
tired of people saying just get therapy bro,tired people saying get therapy bro,2
Passively suicidal,passively suicidal,2
I’m sick and tired of people saying it will get better.,sick tired people saying get better,1
I don’t matter.,dont matter,0
Does everyone actually want to get better?,everyone actually want get better,0
I can't deal with life anymore. It's too heavy.,cant deal life anymore heavy,2
"Depression (and life itself) has turned me into a mean-spirited, bitter person",life turned meanspirited bitter person,2
Just thought about how disappointing it would be to my younger self if he knew where I am now,thought disappointing would younger self knew,2
I spend everyday on screen and laying in bed,spend everyday screen laying bed,2
"I don’t wanna kill myself, I just wanna die ",dont wan na kill wan na die,0
"I brought a rope today , i guess it's finally time",brought rope today guess finally time,2
"Alright life, you win, I give up",alright life win give,2
29 and i have nothing,nothing,2
are meds supposed to make you happier?,med supposed make happier,2
i’m tired of begging people to love me,tired begging people love,1
Feeling horrible because I self isolate when I'm going thru hell mentally,feeling horrible self isolate going thru hell mentally,2
I hate when people say they see potential in me.,hate people say see potential,2
im so angry. what the fuck is wrong with people.,angry wrong people,2
"The more depressed you are, the more people think you’re doing ok",people think youre,2
My depression is so crippling all I do is cry,crippling cry,2
Anhedonia is killing me,anhedonia killing,2
I'll never be happy the way other people are,ill never happy way people,2
Does it ever go away?,ever away,2
Is being dead better than being alive,dead better alive,2
"This is a long, tiring battle. Is it even worth it?",long tiring battle even worth,2
Feeling depersonalization is hands down the worst,feeling depersonalization hand worst,2
I hate existing,hate existing,2
I’m killing myself in 2-5 months,killing month,2
"Every minute a man dies by suicide, my minute is not far",every minute man dy suicide minute far,2
i wish i could just disappear,wish could disappear,2
The idea that depression always has an external cause hurts me,idea always external cause hurt,2
Nothing horrifies me more than the passage of time,nothing horrifies passage time,2
I wish I was never born,wish never born,2
"I feel like I wasted my ""best years""",feel like wasted best year,2
I wish I was never born,wish never born,2
"After a 3 day streak of not drinking, I'm pourin up again...",day streak drinking pourin,2
I just lost my mom,lost mom,2
My brain broke while I had depression,brain broke,2
No reasons to keep going,reason keep going,2
Does depression ever go away,ever away,2
Why for some people life is an enjoyable ride after all while for others seem more like a punishment?,people life enjoyable ride others seem like punishment,2
Do people get S.A.D. in summer?,people get sad summer,2
I’m almost 25 and at this point it’s hopeless. I’m doomed.,almost point hopeless doomed,2
I have lost empathy and dehumanized everyone,lost empathy dehumanized everyone,2
I’ve been depressed since I was 6 and I am about to be 23,since,2
How soon can dogs forget you?,soon dog forget,2
Hey all,hey,2
Can someone just say you see me,someone say see,2
How can a depressed smoker start working out,smoker start working,2
I wanna blow my fucking brains out.,wan na blow brain,2
"I want to be pretty, I want a boyfriend, I want to be mentally well",want pretty want boyfriend want mentally well,0
How can I love myself if I'm broken?,love broken,2
Do antidepressants really fuck u up?,antidepressant really,2
My close friend attempted suicide,close friend attempted suicide,2
I’m spiraling,spiraling,2
What's it like being aware of the high likelihood you might----yourself?,whats like aware high likelihood mightyourself,2
Why is life so unfair?,life unfair,2
"Life is not a blessing, It's a curse.",life blessing curse,2
I cried for the first time in who knows how long ,cried first time know long,2
It just clicked with me that I have zero friends.... ,clicked zero friend,2
"I’m fat, depressed, and I wanna die.",fat wan na die,2
Any older people here who could chat for a while?,older people could chat,2
Finding it harder and harder to justify staying alive,finding harder harder justify staying alive,2
My own mom told me to kill myself,mom told kill,2
Life has been nothing but regrets,life nothing regret,2
I don’t have a will to live anymore,dont live anymore,0
I HATE when people try to turn depression/mental illness into a contest!,hate people try turn depressionmental illness contest,2
Why should I keep on going?,keep going,2
Goodbye,goodbye,2
I hate that people love me and want to help. ,hate people love want help,0
It’s taken me 21 years to realize that it doesn’t get better,taken year realize doesnt get better,2
I want to die,want die,0
I’m too depressed to do anything my therapist tells me,anything therapist tell,2
psychiatrists suck.,psychiatrist suck,2
Does anyone else just feel sad all the time?,anyone else feel sad time,2
is everyone actually depressed?,everyone actually,2
I'm suicidal again,suicidal,2
The holiday season is tough,holiday season tough,2
why does everyone treat each other so fucking awful,everyone treat awful,2
What the hell is life?,hell life,2
how depressed people have friends ?,people friend,2
I have a plan…,plan,2
It's been 20 years and I'm just so tired,year tired,1
Im going to kill myself tomorrow tonight ,going kill tomorrow tonight,2
I seriously think death is the only way out,seriously think death way,2
I wish I could delete myself from life,wish could delete life,2
What is the point if I can't afford anything,point cant afford anything,2
I keep lying to everybody because I can’t get my shit together,keep lying everybody cant get shit together,2
For the first time since I was 9,first time since,2
Can’t stop over thinking and spiraling,cant stop thinking spiraling,2
"Like so many others, I want to die. I have no reason to live.",like many others want die reason live,0
Are people sometimes born depressed?,people sometimes born,2
Why do I want someone to beat/abuse me?,want someone beatabuse,0
How do people do this?,people,2
I wish I could just not exist,wish could exist,2
"I hate hearing ""good morning"" because it rarely ever is one.",hate hearing good morning rarely ever one,2
i dont want to die but i dont want to live,dont want die dont want live,0
Is life a downhill journey?,life downhill journey,2
I’m so tired of being tired all the time.,tired tired time,1
It is the 10-year anniversary of my depression,anniversary,2
(F27) I am losing my battle with Depression,losing battle,2
When is it my turn to experience happiness?,turn experience happiness,2
what's the point in living?,whats point living,2
My girlfriend cheated on me every weekend with the same guy since the beginning,girlfriend cheated every weekend guy since beginning,2
I honestly think being rich would cure all problems..,honestly think rich would cure problem,2
"They really don't get the concept of ""I suffer every day"" huh?",really dont get concept suffer every day huh,2
I wish I could cry,wish could cry,2
sometimes when i feel good i immediately cringe,sometimes feel good immediately cringe,2
"im so tired, so, so tired",tired tired,1
Life is just a scam,life scam,2
Toxic positivity,toxic positivity,2
I know this is annoying but,know annoying,2
My 17 yo son left in April,son left april,2
I cannot wait to die.,wait die,2
I spend all of my life sitting and staring at a screen.,spend life sitting staring screen,2
The thing I hate the most about depression is all the potential time I waste that I could be doing productive.,thing hate potential time waste could productive,2
I’m already dead,already dead,2
"my life isn’t even that bad, why am i so depressed?",life isnt even bad,2
Haven't left bed in months.,havent left bed month,2
I'm terrified that someone sees my sh sc*rs,terrified someone see scrs,2
Are mental hospitals that bad?,mental hospital bad,2
How to not get jealous of people better off and ahead in life than you.,get jealous people better ahead life,2
My boyfriend doesn't believe I have depression,boyfriend doesnt believe,2
Would u rather be dumb but stable or smart but an emotional mess?,would rather dumb stable smart emotional mess,2
brain fog is at its worst,brain fog worst,2
I have no desire to do anything,desire anything,2
Sleepless nights are the worst,sleepless night worst,2
I am planning on killing myself tonight and my therapist is not responding,planning killing tonight therapist responding,2
I don't want to be here anymore,dont want anymore,0
I get sad when I see pictures of people I know partying and having a good time.,get sad see picture people know partying good time,2
Everything just gets worst I'm to the point where I am nostalgic for the years that sucked a little less than now,everything get worst point nostalgic year sucked little le,2
I've destroyed my life,destroyed life,2
How do I tell my parents that I am depressed?,tell parent,2
Does feeling nostalgic make anyone feel terrible?,feeling nostalgic make anyone feel terrible,2
I’m so tired of being surrounded by unhappy adults,tired surrounded unhappy adult,2
I’m tired of being the therapist friend.,tired therapist friend,1
told my parents how i just didn't want to be born.. nothing changed,told parent didnt want born nothing changed,2
I hate my family. I hate my life. I don't enjoy anything.,hate family hate life dont enjoy anything,2
Im 26 and have never experienced what’s it’s like to be loved by someone. Im wondering if I ever will.,never experienced whats like loved someone wondering ever,2
when does life get better?,life get better,2
Do u envy normal people,envy normal people,2
I don't see a future where I don't kill myself,dont see future dont kill,0
I am thinking of committing suicide plz help,thinking committing suicide plz help,2
I wish I had a terminal illness,wish terminal illness,2
i will never be pretty,never pretty,2
LOOK AT ME. I EXIST.,look exist,2
Gotta love it when you try to open up to people about how you feel and they just get mad at you.,got ta love try open people feel get mad,2
I didn't know what to say.,didnt know say,2
I'd do anything to rewind time,anything rewind time,2
Going into psych ward next week…,going psych ward next week,2
Love isn't real. What's the point of living if I'm not gonna be loved?,love isnt real whats point living gon na loved,2
"What's the counter-argument for ""other people have it harder than you""",whats counterargument people harder,2
"I cannot afford therapy in a ""free healthcare"" country",afford therapy free healthcare country,2
Blowing my head off June 10th,blowing head june,2
Life just doesn’t interest me anymore ,life doesnt interest anymore,2
Feel guilty for being depressed,feel guilty,2
Being surrounded by happy and successful people is killing me...,surrounded happy successful people killing,2
Does it always creep up on you?,always creep,2
i’m so jealous of the people who don’t have to deal with mental-health problems,jealous people dont deal mentalhealth problem,2
Summertime sadness,summertime sadness,2
"I want to be creative and productive, but I just. . . can't",want creative productive cant,0
Goodbye.,goodbye,2
Depression makes people avoid/not want to talk to you anymore,make people avoidnot want talk anymore,0
"hey strangers... ""Things will get better"" fucking tired of it",hey stranger thing get better tired,2
Is it normal to feel totally bummed about everything and think you’re an awful person?,normal feel totally bummed everything think youre awful person,2
I miss feeling alive,miss feeling alive,2
Feeling so lonely is the worst sometimes feel like I don’t have a bond with anyone or don’t have anyone to talk to I’m so empty and I wish this never happened where I feel like I have no one and I’m just rambling,feeling lonely worst sometimes feel like dont bond anyone dont anyone talk empty wish never happened feel like one rambling,2
I won't turn 20,wont turn,2
I can't stop avoiding the flow of time by sleeping through it.,cant stop avoiding flow time sleeping,2
KILL MYSELF KILL MYSELF KILL MYSELF ,kill kill kill,2
I feel like I’m just “waiting to die”,feel like waiting die,2
I wish I was never born.,wish never born,2
My friend called me a useless piece of shit when I started venting to her,friend called useless piece shit started venting,2
I Don't Think My Depression Will Ever Go Away,dont think ever away,0
I'm 16 and extremely lonely.,extremely lonely,2
Why do I wanna die but then don’t at the same time?,wan na die dont time,0
I feel like I am just waiting to die,feel like waiting die,2
So I tried therapy the other day,tried therapy day,2
"no friends, no hobbies, no interests, no talents, no goals",friend hobby interest talent goal,2
I want to crawl into a hole and take a break for a few months,want crawl hole take break month,2
how to seek help when i cut myself but am too much of a pussy to kill myself?,seek help cut much pussy kill,2
I don't care for anything at all,dont care anything,0
Obsessed with suicide,obsessed suicide,2
I really need a kind soul.,really need kind soul,2
Rant: All I have to do is be perfect,rant perfect,2
just an average post no one will read,average post one read,2
What's the point of living if you are not happy?,whats point living happy,2
i can't be depressed because i don't have a valid reason,cant dont valid reason,0
I genuinely don’t see the point in living past 35,genuinely dont see point living past,0
I'm so sorry,sorry,2
Somebody please hear me,somebody please hear,2
I’m tired of everything,tired everything,1
So fucking done. Im gonna end my life in the next few hours.,done gon na end life next hour,2
I nearly killed myself,nearly killed,2
Why don’t people get that there isn’t any specific reason to be depressed!,dont people get isnt specific reason,2
"I'm 25 with no career, education, or life experience.",career education life experience,2
alone.,alone,2
Can someone say hi I am having a bad episode,someone say bad episode,2
I cry five times a day,cry five time day,2
I need therapy but I'm broke. What do I do?,need therapy broke,2
Life is miserable,life miserable,2
I hate existence,hate existence,2
Guys I’m scared,guy scared,2
I almost died last night.,almost died last night,2
"Too scared to die, to scared of being alive.",scared die scared alive,2
"I'm so tired of using my phone all the time, but what else can i even do? Stare at the wall!?",tired using phone time else even stare wall,2
I'm hanging myself on Saturday,hanging saturday,2
Apathetic. Don’t even care to kill myself.,apathetic dont even care kill,0
I have nothing except consuming media,nothing except consuming medium,2
Is this normal for a 12-year-old boy to be unsympathetic about mental health?,normal boy unsympathetic mental health,2
I hate how the human mind is designed,hate human mind designed,2
My depression can't be cured,cant cured,2
I spent almost the entire year stuck in bed,spent almost entire year stuck bed,2
I quit therapy,quit therapy,2
Everyone's sick of me. I'm sick of me too.,everyones sick sick,2
Wasting your life,wasting life,2
Started from the bottom now we're......still at the bottom,started bottom werestill bottom,2
"Do you stand still in front of the mirror, motionless and dull?",stand still front mirror motionless dull,2
How do people manage to go through their day with clinical depression?,people manage day clinical,2
I'm so jealous of normal people,jealous normal people,2
If I had access to a gun I would of shot myself years ago,access gun would shot year ago,2
Happiness scares me as i know it's just temporary,happiness scare know temporary,2
Can fatigue from depression come and go throughout the day?,fatigue come throughout day,2
Probably not everyone is meant to have a good life,probably everyone meant good life,2
I have no idea who i am,idea,2
I don’t wanna die but I’m scared I’ll kill myself impulsively one of these days.,dont wan na die scared ill kill impulsively one day,0
Is getting older just accepting life gets worse?,getting older accepting life get worse,2
My friend hates me because I'm suicidal,friend hate suicidal,2
Regret Not Dying Sooner,regret dying sooner,2
Feeling lonely,feeling lonely,2
I'm just wasting my life away.,wasting life away,2
I want to go to sleep and not wake up.,want sleep wake,0
[ Removed by Reddit ],removed reddit,2
Failed suicide..,failed suicide,2
my “friend” made fun of a traumatic experience of mine,friend made fun traumatic experience mine,2
Had to leave a restaurant because I couldn’t stop crying,leave restaurant couldnt stop cry,2
I hate who I am,hate,2
I seriously doubt the effectiveness of modern treatments to mental problems,seriously doubt effectiveness modern treatment mental problem,2
So sick of constantly feeling miserable,sick constantly feeling miserable,2
I don't wanna get better?,dont wan na get better,0
Gonna blow through my car savings and then kill myself for real this time.,gon na blow car saving kill real time,2
I realised that going to the gym is making me sadder,realised going gym making sadder,2
I lost the best girlfriend in the world and never realized it.,lost best girlfriend world never realized,2
Not built for this world and I don't know what to do.,built world dont know,0
I have wasted 10 years of my life.,wasted year life,2
I’m not a people person but not having friends sucks,people person friend suck,2
How to not get emotionally affected by others so easily?,get emotionally affected others easily,2
Upvote this for my ego,upvote ego,2
I've never been so lonely.,never lonely,2
I’m really debating on just ending it ,really debating ending,2
My husband is suicidal but isn’t going to kill himself. How do I help?,husband suicidal isnt going kill help,2
Update: Concerned depressed son may be planning to end his life,update concerned son may planning end life,2
I've lost interest in all my hobbies,lost interest hobby,2
I don’t think anyone understands how much I think about death,dont think anyone understands much think death,2
I hate the holiday season,hate holiday season,2
Fuck it.,,2
"My severely depressed GF says she no longer has feelings for me, should I save the pain and end it?",severely say longer feeling save pain end,2
Sundays are the worst,sunday worst,2
Gaming the shitty feelings away,gaming shitty feeling away,2
I fear I may be incompatible with life,fear may incompatible life,2
i feel alone,feel alone,2
I wish to be a kid again...,wish kid,2
I’m scared that I will never have the balls to kill myself and I’ll be stuck this way forever.,scared never ball kill ill stuck way forever,2
How do you cope with never ending emptiness?,cope never ending emptiness,2
My husband is struggling..,husband struggling,2
"Found a post I made 10 years ago, nothing has changed since",found post made year ago nothing changed since,2
What is it called when you don’t necessarily hate yourself but don’t care either,called dont necessarily hate dont care either,0
I just realized i gave so much in my relationships and literally no one stayed,realized gave much relationship literally one stayed,2
I don’t want to wake up anymore ,dont want wake anymore,0
"Everyone says just talk to someone, but they always mean someone else",everyone say talk someone always mean someone else,2
Can Alcohol make you feel better?,alcohol make feel better,2
Just want to disappear.,want disappear,0
I cant be the only one right?,cant one right,2
I have nothing to live for,nothing live,2
My mask is slipping,mask slipping,2
I think I have considered killing myself every week for the last 10 years,think considered killing every week last year,2
I've lost all desire,lost desire,2
How do people cope for so long?,people cope long,2
Hate humans,hate human,2
“By my assessment you don’t look depressed” it’s a fucking zoom call you knob,assessment dont look zoom call knob,2
please please please someone listen to me,please please please someone listen,2
Depression sucks,suck,2
Will things ever truly get better? ,thing ever truly get better,2
I'm depressed at the state of this cruel sick world,state cruel sick world,2
Are there any activities to do while depressed?,activity,2
I need a good reason why.,need good reason,2
"tired of living, want to die",tired living want die,1
