text,clean_text,tfidf_cluster
"Anyone else get up, get dressed, and then just sit and stare at the floor or wall for 30 minutes trying to figure out why you’re even bothering?",anyone else get get dressed sit stare floor wall minute trying figure youre even bothering,2
Having an office job is the absolute worst thing for depression,office job absolute worst thing,2
"They say, ""Money doesn't buy happiness,"" but it's extremely hard to stay happy when you're broke.",say money doesnt buy happiness extremely hard stay happy youre broke,2
Does anyone else watch an ungodly amount of YouTube videos?,anyone else watch ungodly amount youtube video,2
I don't know how to function around people anymore,dont know function around people anymore,0
Depression prevents you from doing the things you know will make you feel better.,prevents thing know make feel better,2
My brother plans to kill himself on 7/2,brother plan kill,2
"I wish it were socially acceptable to tell your friends ""Hey, my life is super toxic right now and slowly killing me, can we hang out sometime?""",wish socially acceptable tell friend hey life super toxic right slowly killing hang sometime,2
Sleeping because you no longer want to be awake,sleeping longer want awake,0
Sometimes i wish i could donate my life to someone who loves life but is terminally ill,sometimes wish could donate life someone love life terminally ill,2
My best friend died and I don't enjoy anything anymore,best friend died dont enjoy anything anymore,0
"I don't really want to die, but I don't want to be alive.",dont really want die dont want alive,0
I simply want to die,simply want die,0
I regret not committing suicide when I was younger,regret committing suicide younger,2
My bed is my safe place,bed safe place,2
I’m tired of being tired all the time.,tired tired time,1
Do you guys ever quit typing your comment mid-sentence because you feel like your words aren't useful?,guy ever quit typing comment midsentence feel like word arent useful,2
"""it's okay to have days where you hardly get out of bed"" yeh but what if that's every day?",okay day hardly get bed yeh thats every day,2
I WISH I WAS NEVER BORN,wish never born,2
No motivation to do anything,motivation anything,2
"Depression stole my education, it stole all of my friends, my motivation, my dreams, my future, my life, me.",stole education stole friend motivation dream future life,2
Best part of the day is sleeping,best part day sleeping,2
Minecraft,minecraft,2
"I just miss the days when I’d wake up, get right out of bed, shower, then do whatever it was I wanted to do that day.",miss day wake get right bed shower whatever wanted day,2
I'm not fit for life.,fit life,2
Finally going to Therapy.,finally going therapy,2
the anxiety & depression combo is crazy,anxiety combo crazy,2
do you ever feel like you are manipulating people?,ever feel like manipulating people,2
I feel so disconnected with everyone and everything,feel disconnected everyone everything,2
"At this point, or maybe long ago, I'm just accepting the pain and living with it.",point maybe long ago accepting pain living,2
my pain (25F) is overwhelming: i've been quarantining in an abusive household for the last year and am in need of some kind words,pain overwhelming quarantining abusive household last year need kind word,2
I want my outsides to match my insides. I want to look sick.,want outside match inside want look sick,0
I’m 25 and should’ve died as a teenager,shouldve died teenager,2
High functioning depression,high functioning,2
Anyone waste time doing nothing?,anyone waste time nothing,2
"Today, I had my first session with my psychologist.",today first session psychologist,2
Disassociating?,disassociating,2
ive come to realize you can only keep your depression to yourself,come realize keep,2
True loneliness is reached when there's no one you feel comfortable with to talk to about your deepest personal issues,true loneliness reached there one feel comfortable talk deepest personal issue,2
The peace of sleep,peace sleep,2
Happy Thanksgiving!,happy thanksgiving,2
"Has anyone ever been eager, almost desperate to do something productive, but just so unmotivated to do so?",anyone ever eager almost desperate something productive unmotivated,2
"I need at least one person to see this. I have 0 reason to live, because I can't care about my obligations to others.",need least one person see reason live cant care obligation others,2
I just want to sleep forever.,want sleep forever,0
I am a 17 year old student in korea and I am stressed overwhelmingly by academics and the SAT. Please read my story and tell my story to others. I am going to jump next week. Goodbye.,year old student korea stressed overwhelmingly academic sat please read story tell story others going jump next week goodbye,2
How do people just accept working 40+ hours a week for the rest of their lives?,people accept working hour week rest life,2
How the fuck do people find things they actually like and stick with it??,people find thing actually like stick,2
I cant imagine a scenario where im happy in life,cant imagine scenario happy life,2
"You are a ""hero"" if you fight cancer and lose. You are ""disturbed"" if you fight depression and fail.",hero fight cancer lose disturbed fight fail,2
Ever think you're over your depression but then it hits again?,ever think youre hit,2
Low,low,2
Anyone else afraid 24/7 that they will end up a 30 year old fuckup living at home working weekends single with no friends? I am.,anyone else afraid end year old fuckup living home working weekend single friend,2
I don't want to end up in psychiatric hospital,dont want end psychiatric hospital,0
jUsT ExErCiSe bRo jUsT ReAd bOoKs bRo jUsT Go oUt bRo gEt a hObBy bRo,exercise bro read book bro bro get hobby bro,2
jUsT gO tO tHe GyM,gym,2
Labeled as mature for being apathetic,labeled mature apathetic,2
Anyone else in a zombie like state 24/7,anyone else zombie like state,2
Do you ever feel like you are just 3rd-4th ranked option to people?,ever feel like ranked option people,2
"I stay up late at night because I know the sooner I go to bed, the sooner I’ll wake up and have to start my day.",stay late night know sooner bed sooner ill wake start day,2
Life is too much of doing what I don't want to do in order to survive,life much dont want order survive,0
Do you think depression has reduced your mental abilities and affected your decision making skills?,think reduced mental ability affected decision making skill,2
"Does anyone find themselves just going about their lives working, going to school, etc then suddenly overwhelmed by the misery of existence and want to run away and cry?",anyone find going life working going school etc suddenly overwhelmed misery existence want run away cry,2
"Went for 2 AM walk in the rain, finally felt alive and free.",went walk rain finally felt alive free,2
43 and completely lost,completely lost,2
I really hate not taking interest in anything.,really hate taking interest anything,2
"Don't you love it when you're finally feeling okay and having a good time, and then a wave of loneliness washes over you, because you feel like everything you do is pointless, since there is no one to share it with",dont love youre finally feeling okay good time wave loneliness wash feel like everything pointless since one share,2
Anyone masturbate as means to deal with depression?,anyone masturbate mean deal,2
I don't often see anyone mention the addictive nature of depression.,dont often see anyone mention addictive nature,2
"I feel like as a child I didn't learn how to properly function as a person, and now I'm just a burden as an adult",feel like child didnt learn properly function person burden adult,2
"Just because someone has it worse than you, doesn’t mean that your problems don’t matter",someone worse doesnt mean problem dont matter,2
i almost fucked up tonight and now im a mental hospital,almost fucked tonight mental hospital,2
I’m kinda disgusted with myself,kinda disgusted,2
The cancer has spread to my liver,cancer spread liver,2
Is it worth waiting to see if your life eventually ever gets better?,worth waiting see life eventually ever get better,2
Anyone else feel like they have to try and fight to survive because of their depression?,anyone else feel like try fight survive,2
Aging is fucked,aging fucked,2
Started planning a road trip as an alternative to killing myself,started planning road trip alternative killing,2
"I just went from not leaving my room for 3 years with the biggest fear of going outside, to wanting to solo travel again! In 3 days.",went leaving room year biggest fear going outside wanting solo travel day,2
So I bought myself flowers today.,bought flower today,2
"Life in this society is such a catch 22. People are always saying ""reach out, if you ever need me"" but actually don't want to be near anyone depressed. They either deny it or downplay your depression if they find out. Or just outright see you completely differently.",life society catch people always saying reach ever need actually dont want near anyone either deny downplay find outright see completely differently,2
Many pandemic-depressives didn't have empathy for mental health sufferers until it affected them.,many pandemicdepressives didnt empathy mental health sufferer affected,2
"I've never felt so sad, alone, lonely, and isolated before. At the same time I want to stay isolated. I don't want to socialize or be around people. I don't quite understand what's going on with me. I might be broken.",never felt sad alone lonely isolated time want stay isolated dont want socialize around people dont quite understand whats going might broken,0
Im a shut in for almost 10 years,shut almost year,2
You ever just get so fucking sick of yourself?,ever get sick,2
Angry suicide note ig,angry suicide note,2
"I'm not even sad anymore, I'm just empty",even sad anymore empty,2
i honestly can't tell if i'm depressed or lazy as shit,honestly cant tell lazy shit,2
I don’t want to kill myself because of the grief for others. Instead I wish I could just disappear and have nobody remember me.,dont want kill grief others instead wish could disappear nobody remember,0
i’m 17 and my mom just died.,mom died,2
Is it normal to want to stay depressed?,normal want stay,0
I'm literally not good at anything.,literally good anything,2
I finally told my parents I was struggling with depression and suicidal thoughts.,finally told parent struggling suicidal thought,2
"Don't you just hate it when some depressed people act like you don't get to be depressed because ""life isn't hard enough for you""?",dont hate people act like dont get life isnt hard enough,0
"Nobody cares if you're happy or not, they just want you to function.",nobody care youre happy want function,0
Does anyone else feel like their life has been irreversibly destroyed by mental illness?,anyone else feel like life irreversibly destroyed mental illness,2
tired,tired,1
Annus Horribilus,annus horribilus,2
Anyone else's memory gotten really bad since having depression?,anyone el memory gotten really bad since,2
What depression actually looks like.,actually look like,2
"Does anyone else get the feeling that everyone around you is living a fuller, happier, more complex life full of promise?",anyone else get feeling everyone around living fuller happier complex life full promise,2
"I'm not suicidal but if I got hit by a truck and killed, I'd take it.",suicidal got hit truck killed take,2
my genitalia are destroyed after being raped and being prescribed lexapro. i don’t want to live anymore,genitalia destroyed raped prescribed lexapro dont want live anymore,0
Regular Check-In Post,regular checkin post,2
Sometimes I hope I get killed,sometimes hope get killed,2
Good bye everyone! Good way to end it today,good bye everyone good way end today,2
I am really sorry for people who post here and nobody replies.,really sorry people post nobody reply,2
Lonely and unmotivated,lonely unmotivated,2
"Im going to a mental hospital and now I feel like ""Im not depressed enough.""",going mental hospital feel like enough,2
I hate myself so much. Fuck the genetic lottery.,hate much genetic lottery,2
Every time I wake up from sleeping I’m just like *sigh* “fuck.”,every time wake sleeping like sigh,2
Therapy just made me more aware of how isolated I feel because most people suck at empathy,therapy made aware isolated feel people suck empathy,2
Being passively s**cidal is exhausting.,passively scidal exhausting,2
I've showered every day for 5 days.,showered every day day,2
"When I talk about myself, I feel selfish. When I ask others questions about themselves, I'm sad because they don't ask me questions back.",talk feel selfish ask others question sad dont ask question back,2
I don't think mentally healthy people realize how hard living is when there's nothing to look forward to,dont think mentally healthy people realize hard living there nothing look forward,2
I’m going to kill myself,going kill,2
I'm consciously wasting away my life.,consciously wasting away life,2
"It’s funny how quickly I can go from “today was a great, productive day” to “I wish I had the courage to just fucking end it already”",funny quickly today great productive day wish courage end already,2
Anyone else feel like they're just trying to survive rather than live life?,anyone else feel like theyre trying survive rather live life,2
i can’t believe there’s barely 1 month left in 2017...time flies when your life is falling apart,cant believe there barely month left fly life falling apart,2
"If the moods of normal people fall between ""happy"" and ""sad"", the moods of depressed people fall between ""distracted"" and ""miserable"".",mood normal people fall happy sad mood people fall distracted miserable,2
I was born trying to kill myself,born trying kill,2
Tomorrow I'm checking myself into the hospital,tomorrow checking hospital,2
I am 58 M. Seems to be most subscribers are young.,seems subscriber young,2
Why do non-depressed people think depression is about being sad all the time.,nondepressed people think sad time,2
"Diagnosed with cancer, mom passed away, wife asking for a divorce. All within a few days.",diagnosed cancer mom passed away wife asking divorce within day,2
February 22nd 2020,february,2
I can no longer articulate sentences and have a conversation with someone.,longer articulate sentence conversation someone,2
I’m depressed because I’m doing nothing but I’m too depressed to do something,nothing something,2
It's like I'm chronically lazy,like chronically lazy,2
Sleep is my best friend,sleep best friend,2
idk if this is just me,idk,2
I’m a 14 yr old white girl diagnosed by a psychologist with depression,old white girl diagnosed psychologist,2
Does anyone else procrastinate till the last minute and then feel like shit for not doing things earlier,anyone else procrastinate till last minute feel like shit thing earlier,2
"I hate lying on bed all day, being unproductive........but it's the only thing I feel like doing......",hate lying bed day unproductivebut thing feel like,2
lonely,lonely,2
I'm 36 and stuck in years of misery. Depression is my self identity now and I don't know how to change it. Planet earth literally seems pointless and I dont' know how billions of people can just live these meaningless lives.,stuck year misery self identity dont know change planet earth literally seems pointless dont know billion people live meaningless life,0
Depression leads to procrastination and procrastination to depression.,lead procrastination procrastination,2
Tried to draw how I'm feeling,tried draw feeling,2
A therapist just refused to treat me because my life is too fucked up for him to fix.,therapist refused treat life fucked fix,2
Does 2018 seem like a blur to anyone else?,seem like blur anyone else,2
I’m having one of those days where I am feeling the worst of my depression,one day feeling worst,2
I Don't Want To Do Any Fucking Thing With My Life,dont want thing life,0
muted myself to cry while on the phone with my mom,muted cry phone mom,2
I have lost interest in people,lost interest people,2
I socially isolate myself and then wonder why people don't ask to hang out.,socially isolate wonder people dont ask hang,2
The thought that I can kill myself at some point in my life comforts me.,thought kill point life comfort,2
I lost my personality.,lost personality,2
The fact that I have owe $2k in therapy sessions is ridiculous...,fact owe therapy session ridiculous,2
i want to kill myself,want kill,0
Does anyone else just sit around and do nothing a lot of the time?,anyone else sit around nothing lot time,2
Has anyone else seen a significant drop in their IQ as a result of their mental illness?,anyone else seen significant drop result mental illness,2
"Depression feels more ""real"" - optimism feels like a delusion",feel real optimism feel like delusion,2
The fact that most people get to wake up every day and feel completely fine has always been so weird to me.,fact people get wake every day feel completely fine always weird,2
being alive is so exhausting,alive exhausting,2
I feel too sensitive to exist,feel sensitive exist,2
I can't kill myself until my cat dies,cant kill cat dy,2
Do you ever secretly wish for bad things to happen in your life so you feel justified to be depressed?,ever secretly wish bad thing happen life feel justified,2
"suicide isnt the answer, but people shouldn't call it the coward's way out",suicide isnt answer people shouldnt call coward way,2
i hate waking up in the morning,hate waking morning,2
No one showed. I should have expected that.,one showed expected,2
MY FAILURES MAKE ME FEEL GUILTY. I DON'T FEEL WORTHY TO HAVE FRIENDS OR BE AROUND FAMILY. ITS UNCOMFORTABLE AND CONVICTING.,failure make feel guilty dont feel worthy friend around family uncomfortable convicting,2
Everything hurts,everything hurt,2
"Fuck life, fuck being awake.",life awake,2
I sold my guns.,sold gun,2
Does anyone else’s depression make them feel dumb? Or...unable to focus on school work or semi difficult tasks?,anyone el make feel dumb orunable focus school work semi difficult task,2
I disappointed everyone that expected great things from me,disappointed everyone expected great thing,2
"I am no longer a 21yo, unemployed, kissless virgin living with my parents!",longer unemployed kissless virgin living parent,2
I’m literally having a breakdown every night,literally breakdown every night,2
I want to fuck up my life,want life,0
The “no sleep” cycle.,sleep cycle,2
Is life only about distracting myself until I die?,life distracting die,2
"I procrastinate because I'm depressed, and I'm depressed because I procrastinate",procrastinate procrastinate,2
"Anyone else find that, while you're super hard on yourself, you're almost too forgiving of others?",anyone else find youre super hard youre almost forgiving others,2
Casually suicidal?,casually suicidal,2
What's the point of working to live?,whats point working live,2
My girlfriend has severe depression.,girlfriend severe,2
"I can't deal with it anymore, I'm ending my life.",cant deal anymore ending life,2
I don't care about anything anymore I'm just existing,dont care anything anymore existing,0
Life is just deeply unsatisfying.,life deeply unsatisfying,2
I’m just here to say fuck depression.,say,2
I feel so bad for my parents. They deserve better.,feel bad parent deserve better,2
Isn’t is weird how one minute you can be absolutely fine and then the next spiralling back down into depression. I’m way too sensitive.,isnt weird one minute absolutely fine next spiralling back way sensitive,2
Wish me luck. Voluntarily committing myself to hospital for severe depression.,wish luck voluntarily committing hospital severe,2
"Ever feel like you've been depressed for so long, you can't imagine not being depressed?",ever feel like youve long cant imagine,2
Life is genuinely not worth living as a stupid person,life genuinely worth living stupid person,2
i'm so close to killing myself,close killing,2
Sudden sadness after socializing,sudden sadness socializing,2
"I am not miserable enough to end my life, but I am also not happy enough to want to keep living",miserable enough end life also happy enough want keep living,0
I just can't fucking cope with life,cant cope life,2
Working out is doing absolutely nothing for my depression,working absolutely nothing,2
I opened up to a friend and she called me a loser,opened friend called loser,2
I haven’t gotten out of bed in a month,havent gotten bed month,2
There's no getting better. You just become numb to it.,there getting better become numb,2
I'll be 26 in 3 days and all I can think about is that I've comepletly wasted my life,ill day think comepletly wasted life,2
"""Just go to the gym""",gym,2
I want a redo badly,want redo badly,0
24 F I’m killing myself tonight and no one knows,killing tonight one know,2
One of the saddest feelings is really trying to heal and realizing your depression became a part of you.,one saddest feeling really trying heal realizing became part,2
Finally let my wife know I was suicidal and she told me to essentially man up and figure it out myself…,finally let wife know suicidal told essentially man figure,2
I’m a depressed therapist,therapist,2
Is it normal for someone with depression doesn't reply messages for half a year?,normal someone doesnt reply message half year,2
I’m fucking disgusting ,disgusting,2
I'm losing it,losing,2
When you’re truly depressed..,youre truly,2
Tonights the night.,tonight night,2
"I'm 17. Since I was ten, I've done nothing but sit in my room completely isolated nearly every day.",since ten done nothing sit room completely isolated nearly every day,2
so jealous of people with normal functioning brains💔,jealous people normal functioning brain,2
"""Mild"" depression is fucking torture.",mild torture,2
I think I’m just not built for life,think built life,2
looking back at my old childhood photos makes me really sad,looking back old childhood photo make really sad,2
I’m trying but nothing seems to matter,trying nothing seems matter,2
I've been depressed my entire life. They lied. Getting older doesn't make it better.,entire life lied getting older doesnt make better,2
No wonder so many people get addicted to drugs,wonder many people get addicted drug,2
"Had I commit suicide, no one would know until my rent is due",commit suicide one would know rent due,2
"If i kill myself, i just wish people to understand that this life wasn't for me and make peace with it.",kill wish people understand life wasnt make peace,2
This illness is stealing my youth,illness stealing youth,2
"Antidepressants destroyed me, I think I'm out",antidepressant destroyed think,2
Sleeping is my favorite activity,sleeping favorite activity,2
'Depression is a choice',choice,2
I wish I had drive or ambition. Feel like I’m just paddling to survive.,wish drive ambition feel like paddling survive,2
I literally can't live a normal life due to mental illness.,literally cant live normal life due mental illness,2
You know what sucks. Being self aware enough to feel and realize you're going into a depressive episode but not being able to do a damn thing about it.,know suck self aware enough feel realize youre going depressive episode able damn thing,2
I’m 26 years old and have nothing to show for it.,year old nothing show,2
Living with functional depression is a fucking drag.,living functional drag,2
I wish more people understood depression is nothing like sadness,wish people understood nothing like sadness,2
i cannot stop bed rotting,stop bed rotting,2
I’m going to kill myself tonight,going kill tonight,2
I hate my life. I wish I was never born.,hate life wish never born,2
Just started my shift and I want to cry.,started shift want cry,0
All I look forward to is sleeping.,look forward sleeping,2
The suicidal fantasies are getting worse. ,suicidal fantasy getting worse,2
Watching everyone surpass me in life makes me feel like such shit.,watching everyone surpass life make feel like shit,2
I made my roommate uncomfortable :(,made roommate uncomfortable,2
All of my old classmates are doing better than me,old classmate better,2
Just wanna kill myself so I can stop adulting,wan na kill stop adulting,2
I feel stupid for not having killed myself after talking and thinking about it for years,feel stupid killed talking thinking year,2
Is there such a thing as incurable depression?,thing incurable,2
The gas attendant asked if I was okay,gas attendant asked okay,2
why has depression made me significantly more stupid?,made significantly stupid,2
Suicide,suicide,2
I'm turning 37 in less than an hour and I'd rather stop existing,turning le hour rather stop existing,2
Pretending to be happy takes a lot of energy,pretending happy take lot energy,2
Snapped out of depression only to fall back because I lost my youth due to depression,snapped fall back lost youth due,2
Life is kinda easier once you accept you don’t have to live up to expectations and you are a failure,life kinda easier accept dont live expectation failure,2
What the fuck is the point of living,point living,2
how can people with depression have romantic relationship?,people romantic relationship,2
Feels like I’m addicted to literally every source of dopamine,feel like addicted literally every source dopamine,2
She called it quits,called quits,2
"""Making it through the day"" is all I do. Every fucking day.",making day every day,2
They always say there were never any signs ... My signs are out there but they're ignored,always say never sign sign theyre ignored,2
Late 20s,late,2
I think I've lost the ability to learn or read or understand anything complex especially academics.,think lost ability learn read understand anything complex especially academic,2
I hate how mean depression has made me,hate mean made,2
