text,clean_text,tfidf_cluster
"Our most-broken and least-understood rules is ""helpers may not invite private contact as a first resort"", so we've made a new wiki to explain it",mostbroken leastunderstood rule helper may invite private contact first resort weve made new wiki explain,2
"Regular check-in post, with information about our rules and wikis",regular checkin post information rule wikis,2
Are there any 'alternatives' to dying?,alternative dying,2
"What is your ""I'm coming out of a depressive episode"" sign?",coming depressive episode sign,2
I want a hug so bad...,want hug bad,0
I feel like I can’t live life,feel like cant live life,2
How do I tell my therapist I want to die without being committed? ,tell therapist want die without committed,0
Is it normal to stop enjoying the taste of food while depressed?,normal stop enjoying taste food,2
Can depression be an addiction?,addiction,2
Tired lol ,tired lol,1
"Just Everything TW: Self Harm, Suicidal Thoughts",everything self harm suicidal thought,2
I can't do this anymore ,cant anymore,2
I want someone i can cry to,want someone cry,0
how do i get out of a depressive episode?,get depressive episode,2
When will the fatigue end?,fatigue end,2
I feel like my depression isn't valid tw self harm,feel like isnt valid self harm,2
Everyday I wish I could fall asleep and never wake up again ,everyday wish could fall asleep never wake,2
Just want to die ,want die,0
"Been having a rough year, I just really need a hug and someone to cry to.",rough year really need hug someone cry,2
My life has been going really well recently but now I'm up at 4am crying and I don't know why,life going really well recently cry dont know,0
"""Funny"" how it doesn't get any better.",funny doesnt get better,2
Why does no one care about me,one care,2
I Want to Run Away and Live on a Farm,want run away live farm,0
I hate my mom most of the time ,hate mom time,2
I don’t think medicine works on me ever,dont think medicine work ever,2
I can’t keep going,cant keep going,2
No Motivation - Feel Stuck/Paralyzed,motivation feel stuckparalyzed,2
excessive regret,excessive regret,2
too much of a pussy to die,much pussy die,2
I don't know at this point what m illnesses I have,dont know point illness,0
how does one live ,one live,2
Battle with depression ,battle,2
It's really hard today,really hard today,2
I think I'm depressed ,think,2
Personal Hygiene,personal hygiene,2
Alone in high school,alone high school,2
I don’t know what form of depression this is but it sucks,dont know form suck,0
Depressive episode,depressive episode,2
Life Feels Meaningless ,life feel meaningless,2
Life is just not fun,life fun,2
Can't seem to make it better,cant seem make better,2
I want to be a child again but loved this time :(,want child loved time,0
"What’s the point of living if you have anhedonia? Can’t feel an ounce of pleasure, joy or excitement and it’s been years.",whats point living anhedonia cant feel ounce pleasure joy excitement year,2
It’s becoming increasingly difficult to continue ,becoming increasingly difficult continue,2
Parents are moving away during the worst of my mental health,parent moving away worst mental health,2
I don’t want to be here anymore. ,dont want anymore,0
I have hard time connecting with people pls help ,hard time connecting people pls help,2
can you see a psychiatrist without doing therapy? please help,see psychiatrist without therapy please help,2
Please tell me my problem is not that bad,please tell problem bad,2
Emo…,emo,2
i'm a background character in my own life,background character life,2
I'm a piece of shit.,piece shit,2
I feel so behind in life,feel behind life,2
Terrible teeth will be the death of me.,terrible teeth death,2
I can’t get out of bed,cant get bed,2
"I just missed my finals exam, Mother went crazy",missed final exam mother went crazy,2
I’m doing really bad rn,really bad,2
Missing out on EVERYTHING and regretting it all,missing everything regretting,2
Comfort Shows,comfort show,2
Update of how my life is right now.,update life right,2
"just keep swimming, just keep swimming, just keep swimming",keep swimming keep swimming keep swimming,2
It’s little more complicated. ,little complicated,2
vent,vent,2
why can’t i just get better?,cant get better,2
When everything makes you want to die,everything make want die,0
No longer feeing like myself,longer feeing like,2
Tired,tired,1
endless feedback loop,endless feedback loop,2
I think about ending it every day ,think ending every day,2
i'm scared i'm always going to feel this way,scared always going feel way,2
please dont do it,please dont,0
"Bad life decisions, regret, lack of faith, overwhelming depression - need for any help/prayer",bad life decision regret lack faith overwhelming need helpprayer,2
is this wrong? ,wrong,2
I AM worthless.,worthless,2
why is it so hard for people to understand some things are physically impossible?,hard people understand thing physically impossible,2
i have everything but im still depressed ,everything still,2
Career depression ,career,2
"After my mother passed away, it seems like I’m left alone",mother passed away seems like left alone,2
i want to die so bad,want die bad,0
Syrian rue (harmala) as a treatment for depression?,syrian rue harmala treatment,2
"If you’re not them, you’ll never understand",youre youll never understand,2
Overwhelmed,overwhelmed,2
23m I have hard time connecting with people pls help ,hard time connecting people pls help,2
I'm paralyzed ,paralyzed,2
I'm scared of the future,scared future,2
"My whole life, I’ve been treated as a nuisance ",whole life treated nuisance,2
I don’t want to live but I don’t want to die…,dont want live dont want die,0
depressive episode  ,depressive episode,2
I dream of my self destruction ,dream self destruction,2
Mom died April 19 and I'm ready to go too ,mom died april ready,2
Why?,,2
I feel terrible once again.,feel terrible,2
"Help! When days of no appetite, what can I drink and what vitamins might I need? ",help day appetite drink vitamin might need,2
Tired,tired,1
Will the cognitive side effect of depression improve?,cognitive side effect improve,2
Is there purpose?,purpose,2
Have officially stopped taking my meds....,officially stopped taking med,2
Just wanted to post an update,wanted post update,2
Delusion is the key to success,delusion key success,2
Late nights suck,late night suck,2
There is nothing I can do,nothing,2
When it Returns,return,2
Alone,alone,2
Am i depressed?,,2
I hate my life and want to leave everything behind,hate life want leave everything behind,0
Can someone please help me?,someone please help,2
It's getting worse,getting worse,2
I really need a hug right now...,really need hug right,2
I just had the realization that I’m such a downer and it’s impacting my relationships,realization downer impacting relationship,2
Any advice on how to get urges to self harm to go away or just keep them under control,advice get urge self harm away keep control,2
A lame rant about how I feel,lame rant feel,2
I wish my life would just stop,wish life would stop,2
(19m) Feeling destined to commit suicide. I just need to write it down somewhere.,feeling destined commit suicide need write somewhere,2
Feeling lost and depressed,feeling lost,2
I am broken,broken,2
I have no guts to end it.,gut end,2
All of my issues ,issue,2
Toxicity ,toxicity,2
How do I make life feel worth living ,make life feel worth living,2
I need serious help and it just doesn’t exist ,need serious help doesnt exist,2
I feel nothing,feel nothing,2
28 yo is it over ? ,,2
I fucking hate myself,hate,2
Can someone be my friend? I don't have anyone to talk to.,someone friend dont anyone talk,0
Is creativity a bad thing?,creativity bad thing,2
post uni depression,post uni,2
Loneliness and depression ,loneliness,2
Feeling hopeless ,feeling hopeless,2
I don't know what to write,dont know write,0
How do I start a conversation?,start conversation,2
Do u guys also have a never ending need for sleep while depressed? - it fucks my life up ,guy also never ending need sleep fuck life,2
I'm only just starting to really notice how low I am ,starting really notice low,2
I sabotage my happiness and I don't even know why. ,sabotage happiness dont even know,0
Traversing difficult situation ,traversing difficult situation,2
How much does your climate/location influence your depression?,much climatelocation influence,2
Medication side effects - heat intolerance/acne,medication side effect heat intoleranceacne,2
i feel like im never going to be happy,feel like never going happy,2
I'm fantasizing about killing myself,fantasizing killing,2
Depressive episode,depressive episode,2
Well i got fired yesterday ,well got fired yesterday,2
I want some ways to come out of depression ,want way come,0
I have lost interest in even changing anything.,lost interest even changing anything,2
Trintellix(Vortioxitine),trintellixvortioxitine,2
Where are all the other depressed people that actually view this shit hole for what it is? ,people actually view shit hole,2
Overcoming SA ,overcoming,2
"I’ve found a trigger for my depression, but I have no idea what to do about it. ",found trigger idea,2
Advice..? Maybe ,advice maybe,2
Absolutely everything is so hard,absolutely everything hard,2
Depression and loneliness,loneliness,2
My SIL is being taken off life support tomorrow and I’m forbidden to go to the hospital to show my support ,sil taken life support tomorrow forbidden hospital show support,2
"I want to be something in life, but I don’t want honestly to do something, and that’s awful",want something life dont want honestly something thats awful,0
My brother got my car (1990 ford mustang 5.0) into a wreck and now I'm the a-hole for losing it over my car,brother got car ford mustang wreck ahole losing car,2
Having a hard time with life and my parents ,hard time life parent,2
Can’t do it anymore,cant anymore,2
Depression vent session ,vent session,2
Recent fall,recent fall,2
Help,help,2
My photo galery is full of myself - self image problems,photo galery full self image problem,2
New medicine ,new medicine,2
I'm spiraling ,spiraling,2
[Rant] Feeling like an NPC in my own life,rant feeling like npc life,2
Depressed over hair loss ,hair loss,2
Helplessly hopeless ,helplessly hopeless,2
I have no motivation anymore lol,motivation anymore lol,2
Am I facing burnout or is this my normal? ,facing burnout normal,2
So close to being happy so why so much bastard pain,close happy much bastard pain,2
Public health sucks,public health suck,2
I got blown by guys and I want to end it all. I can’t live with this ,got blown guy want end cant live,0
Struggling with Life at 27 - Feeling Lost and Hopeless,struggling life feeling lost hopeless,2
I feel overwhelmed and like I'm drowning.,feel overwhelmed like drowning,2
Tried jumping off the roof,tried jumping roof,2
"Man, they were right all along.",man right along,2
How to taper off Wellbutrin (150mg) and Lexapro (10mg) at the same time (see body),taper wellbutrin lexapro time see body,2
"What's the point dude, I fucked up",whats point dude fucked,2
I need help,need help,2
Those days,day,2
Failed suicide attempt.,failed suicide attempt,2
How much would it help if you worked 5 less hours per week?,much would help worked le hour per week,2
Relationships ,relationship,2
Tried to commit and failed,tried commit failed,2
Need Help…,need help,2
Am I depressed?,,2
When will I catch a break?,catch break,2
venting....,venting,2
My life.,life,2
My Depression Works Harder Than I Do,work harder,2
Why i can't stand taking antidepressants?,cant stand taking antidepressant,2
Is this even depression or has it morphed into some other eldritch being?,even morphed eldritch,2
Trauma is haunting me ,trauma haunting,2
I feel lost ,feel lost,2
Post death,post death,2
I am 18 and I want to end things,want end thing,0
My dad just died,dad died,2
What’s the longest you have been depressed before?,whats longest,2
I'm tired.,tired,1
Enjoy my profile for the day because I'll most likely be deleting it by the end of the day ✌️ ,enjoy profile day ill likely deleting end day,2
Worthless,worthless,2
I really need someone to tell me everything’s gonna be ok.,really need someone tell everythings gon na,2
Depressed after two months of happiness ,two month happiness,2
I'm so lonely,lonely,2
I can't do this anymore,cant anymore,2
"I'm lost really , I don't know what to do anymore .",lost really dont know anymore,0
A Cure With Words,cure word,2
The end,end,2
I almost killed myself tonight,almost killed tonight,2
How to overcome depression without any professional support ? ,overcome without professional support,2
How do I get better/improve myself ,get betterimprove,2
Last Plea For Help? 😭,last plea help,2
Help,help,2
I want to die but idk,want die idk,0
Why people/my family still care about me when I no longer feel I have a purpose or value in life anymore?,peoplemy family still care longer feel purpose value life anymore,2
Should I commit suicide? (2),commit suicide,2
I'm so tired of myself ,tired,1
lately i can stop thinking about off-ing myself ,lately stop thinking offing,2
How can I save my relationship when my partner has depression?,save relationship partner,2
I am full,full,2
What's the point ,whats point,2
What’s the point ?,whats point,2
Wie rette ich am besten meine Beziehung wenn mein Partner Depressionen hat?,wie rette ich besten meine beziehung wenn mein partner depressionen hat,2
Who wants to talk?,want talk,0
i want to end myself,want end,0
My emotions might be actually killing me (Vent),emotion might actually killing vent,2
I believe I CAN get my life together I just don’t WANT to.,believe get life together dont want,0
Have you guys always felt like your life is over no matter what age you are? ,guy always felt like life matter age,2
"So tired, but to much of a coward to end it...",tired much coward end,1
How do I forget her,forget,2
I can’t make up my mind ,cant make mind,2
idk what to do ,idk,2
Stuck in inactivity for 2 years now,stuck inactivity year,2
I dont know what is wrong with me,dont know wrong,0
Feeling hopeless at 40,feeling hopeless,2
Dad ,dad,2
I just want to pay for my sins,want pay sin,0
i dont know what to do anymore im thinking about just ending it ,dont know anymore thinking ending,0
Don’t know how much longer I can go,dont know much longer,0
Might be failing college because of depression ,might failing college,2
i hate being alive,hate alive,2
I need help,need help,2
I think that's it,think thats,2
i need to get help fr (sorry this is my first post and im not good at english TT),need get help sorry first post good english,2
Any success stories for MDD? ,success story mdd,2
WHATS THE MEANING OF LIFE?,whats meaning life,2
Need advice,need advice,2
I wish I’m not going to wake up tomorrow,wish going wake tomorrow,2
I hate everything,hate everything,2
I can’t move at this point,cant move point,2
My sadness,sadness,2
Small rant,small rant,2
"Be real, is there any solution from long term sober from happiness?",real solution long term sober happiness,2
Why do I hate my friends ?,hate friend,2
It always comes back,always come back,2
Realistically what steps should I take before just giving up?,realistically step take giving,2
i get it now bro i really do,get bro really,2
okay venting again,okay venting,2
Life scares me more than death ,life scare death,2
???,,2
“Anxious Depression”,anxious,2
What I did wrong with my life?,wrong life,2
School is making me suicidal,school making suicidal,2
H,,2
How to get out of sleep-binge eat cycle?,get sleepbinge eat cycle,2
A never ending spiral?,never ending spiral,2
A case of the morbs,case morbs,2
How to get over the worst depression of your life? ,get worst life,2
Advice please ,advice please,2
"I dont have friends or know how to make them. This makes me feel not good enough which leads to baisng self worth on them and leads to Desperation, Neediness, Seeking their Approval, Validation, Attention",dont friend know make make feel good enough lead baisng self worth lead desperation neediness seeking approval validation attention,2
I'm so tired of attracting users,tired attracting user,2
I am failing Highschool,failing highschool,2
My depression made her suffer alone what do I do ,made suffer alone,2
Please help. CT scans give me depression,please help scan give,2
Let's talk,let talk,2
Why do some people struggle so much with pain and others get to live the life they want with much ease? ,people struggle much pain others get live life want much ease,0
I’m trying to feel positive about life these days,trying feel positive life day,2
How can I get on with life? ,get life,2
Long time coming,long time coming,2
I feel lonely at night,feel lonely night,2
I need help Struggling to find motivation to do things I love,need help struggling find motivation thing love,2
Manic episode recovery,manic episode recovery,2
feel like a terrible person for having very little feelings about life and relationships,feel like terrible person little feeling life relationship,2
Advice - Friend in another state thinks I’m excluding them,advice friend another state think excluding,2
"I feel lonely, depressed even though I have a lot of good things ",feel lonely even though lot good thing,2
I'm Depressed and don't know what to do.,dont know,0
Loneliness,loneliness,2
Is freedom just an illusion? I'm feeling hopeless,freedom illusion feeling hopeless,2
Hate my life tired of freeze state just wanna explode and hurt,hate life tired freeze state wan na explode hurt,2
It is hard to not be depressed when you know you have a low quality of life,hard know low quality life,2
I don’t meet people like me anymore,dont meet people like anymore,0
I'm on the brink of suicide,brink suicide,2
How to be happy,happy,2
Adopting a pet when you’re depressed - yay or nay?,adopting pet youre yay nay,2
I’m slowly dying inside,slowly dying inside,2
i hate being treatment resistant,hate treatment resistant,2
Is this Depression and Anxiety? ,anxiety,2
i hope i don’t wake up tomorrow ,hope dont wake tomorrow,0
White Depression/Guilt ,white depressionguilt,2
The coward who can’t kill himself,coward cant kill,2
Lies have short legs,lie short leg,2
I wanna die but i can’t,wan na die cant,2
How to do stuff,stuff,2
"Extreme ideation, yet I don't feel all that depressed or seem it",extreme ideation yet dont feel seem,2
I’m really fucked up and just want to talk,really fucked want talk,0
Can't do anything right,cant anything right,2
This is my cry for help..,cry help,2
I suck at everything no matter what i do.,suck everything matter,2
Accepting that you don't enjoy life no matter what you do?,accepting dont enjoy life matter,2
"I wanna Die, I have no one who cares about me. ",wan na die one care,2
isolation,isolation,2
I’m depressed as fuck because of my teeth,teeth,2
doesn't qualify,doesnt qualify,2
I deeply regret not fulfilling my revenge. Now it's too late,deeply regret fulfilling revenge late,2
"I feel like shite, now that I don't see my friend anymore",feel like shite dont see friend anymore,0
Not sure if I can take the depression anymore,sure take anymore,2
I found out that I may have depression,found may,2
"Any rational advice to help me get over ""existential crisis"" irrational fear of death.",rational advice help get existential crisis irrational fear death,2
I'm done.,done,2
Is there hope?,hope,2
What do you do when everything feels pointless?,everything feel pointless,2
I broke down in front of my mum saying how lonely I was and she didn’t care,broke front mum saying lonely didnt care,2
Weeds helps me not to burst into crying fits,weed help burst cry fit,2
Feels,feel,2
I wish there was something other than life,wish something life,2
I'm 14M and I've lost my will to live.,lost live,2
Ramblings of a dejected theater kid.,ramblings dejected theater kid,2
I failed college after years of wanting to drop out. Need support,failed college year wanting drop need support,2
I just feel so sad when I think about people ,feel sad think people,2
Been missing school since 4th grade,missing school since grade,2
Why do I feel like I’m just convincing myself I’m depressed?,feel like convincing,2
I don't know what to do anymore ,dont know anymore,0
"Necesito vivir sola, pero todo el proceso me da miedo.",necesito vivir sola pero todo proceso miedo,2
Book recommendations ,book recommendation,2
I’m lost and don’t know what to do.,lost dont know,0
Should I tell my partner I tried to commit suicide yesterday? ,tell partner tried commit suicide yesterday,2
"Harder, ",harder,2
Having no friends,friend,2
My long distance girlfriend attempted suicide by slitting her wrist and I don't know what to do.,long distance girlfriend attempted suicide slitting wrist dont know,2
I can't do it anymore.,cant anymore,2
I wanted to speedrun life but now that days go by real quick I’m actually scared. ,wanted speedrun life day real quick actually scared,2
I don’t know anything ,dont know anything,0
I Am A Worthless Piece of Meat and Life Is Too Long,worthless piece meat life long,2
My Depression coincides with Bordem,coincides bordem,2
God shouldn't have given me Fertility ,god shouldnt given fertility,2
When to take SSRI meds when going on holiday with 9 hour time difference? ,take ssri med going holiday hour time difference,2
feeling lost and hopeless,feeling lost hopeless,2
How the fuck do I improve,improve,2
Only thing keeping me alive is my kids,thing keeping alive kid,2
Feel like I'm suffocating ,feel like suffocating,2
Whole family died during 2022-24,whole family died,2
Doomer Post,doomer post,2
Ignored or Forgotten,ignored forgotten,2
Why can’t i just let myself be happy,cant let happy,2
I am broken. Why do I push away the person I love the most,broken push away person love,2
I can't fall asleep at night and can't wake up in the morning,cant fall asleep night cant wake morning,2
wake up without anything to do,wake without anything,2
Another night ,another night,2
Things u cant change,thing cant change,2
I'm tired ,tired,1
I’m feeling like I’m close to my breaking point,feeling like close breaking point,2
My therapist says I was traumatized by heartbreak. But how could l be traumatized by something so trivial? ,therapist say traumatized heartbreak could traumatized something trivial,2
tired can’t sleep ,tired cant sleep,1
I don't know what to do anymore,dont know anymore,0
I don't know what to do,dont know,0
Experiences with Anti depressants? Fluoxetine specifically ,experience anti depressant fluoxetine specifically,2
Do hookups cause depression?,hookup cause,2
I might kill myself ,might kill,2
Not sure if this counts as a relapse?,sure count relapse,2
"Life sucks, no doubt.",life suck doubt,2
I wish I was as suicidal as I used to be,wish suicidal used,2
Almost thought I'd get better,almost thought get better,2
Epsiode gone on too long,epsiode gone long,2
Midnight Rant,midnight rant,2
kms or run away,km run away,2
grieving the past,grieving past,2
WHy am I still alive???,still alive,2
I need a reason to live,need reason live,2
Need Advice,need advice,2
Venting,venting,2
I could not care for anything anymore,could care anything anymore,2
I've been dumped on for two years straight,dumped two year straight,2
Losing mind,losing mind,2
How do I know if I need medication ,know need medication,2
I wish I was normal so bad,wish normal bad,2
Hidden Depression,hidden,2
"No matter what, i can't stop feeling like a horrible person",matter cant stop feeling like horrible person,2
Relationship help ,relationship help,2
Feeling like I'm holding the people in my life back.,feeling like holding people life back,2
"No matter what I think, few weeks later, I experience bad things",matter think week later experience bad thing,2
Advice for crawling out of the hole?,advice crawling hole,2
I feel like I've run out of options,feel like run option,2
I can't stand living as an autistic and lonely loser.,cant stand living autistic lonely loser,2
I just realized,realized,2
How,,2
being a fucking rag,rag,2
I feel like there’s literally no point in trying any more,feel like there literally point trying,2
No Interest in Anything ,interest anything,2
need help on wtf to do with life ,need help wtf life,2
I’m trying,trying,2
Never growing up?,never growing,2
how do i support my depressed and suicidal ex boyfriend ?,support suicidal boyfriend,2
maybe someday ,maybe someday,2
Traumatized and Depressed ,traumatized,2
how to tell parents,tell parent,2
Incredibly depressed after vacation ,incredibly vacation,2
I don’t think I can cry anymore,dont think cry anymore,0
"I'm exhausted. ""Je suis épuisée"". And I don't know how to say it anymore.",exhausted suis épuisée dont know say anymore,0
This is garbage,garbage,2
What's the relationship between Addiction and Depression?,whats relationship addiction,2
How do I change alone if the depression takes your autonomy? ,change alone take autonomy,2
i don't know what to do anymore,dont know anymore,0
Will it end?,end,2
Help for my friend,help friend,2
Feel like I’m overwhelming my partner,feel like overwhelming partner,2
My vent,vent,2
"I'm tired. I'm so, so tired.",tired tired,1
Joy in life,joy life,2
random bursts of happiness?,random burst happiness,2
i’m so exhausted and I genuinely don’t know what to do anymore,exhausted genuinely dont know anymore,0
Don’t know what my future will look like ,dont know future look like,0
"in workplace, yes! beauty and attractiveness is everything",workplace yes beauty attractiveness everything,2
Urge to ruin everything good you have?,urge ruin everything good,2
Is it possible that this is just my personality ,possible personality,2
Should I be afraid?,afraid,2
Keep going despite the depression ,keep going despite,2
"I watched The Simpsons again, and I cried. ",watched simpson cried,2
I wish that I was dead,wish dead,2
